{"evaluation":{"cases":[{"descriptor":{"digest":"sha256:b8dc8bb6bc77fa7c09e2f7968e1d7f08216e97d461489d201fff930c2c905f1b","mediaType":"application/vnd.agentsuite.eval.case.v1+json","size":270},"id":"capital","minPasses":1,"path":"evals/writer/cases/capital.json","runs":1},{"descriptor":{"digest":"sha256:a37f60068526aa1a5c83674574273aefa49528c6f16afeb0f4586722cbf804af","mediaType":"application/vnd.agentsuite.eval.case.v1+json","size":204},"id":"arithmetic","minPasses":1,"path":"evals/writer/cases/arithmetic.json","runs":1}],"index":{"descriptor":{"digest":"sha256:f96e916194c06440ef5a16283ae495b7c7d48db94ee5eebca0847afe354c9119","mediaType":"application/vnd.agentsuite.eval.index.v1+json","size":592},"path":"evals/writer/index.json"}},"evaluator":{"completedAt":"2026-01-01T00:01:00Z","identity":{"id":"example","policy":{"configurationDigest":"sha256:b9368142823e38e788a3385283cf5d679aa67d58a58681b0dd3923a3ac9d642a","id":"agentsuite-text-v1","version":"1.0.0"},"version":"1.0.0"},"startedAt":"2026-01-01T00:00:00Z"},"execution":{"configurationDigest":"sha256:b9368142823e38e788a3385283cf5d679aa67d58a58681b0dd3923a3ac9d642a","harness":{"digest":"sha256:b9368142823e38e788a3385283cf5d679aa67d58a58681b0dd3923a3ac9d642a","id":"example","version":"1.0.0"},"model":{"configurationDigest":"sha256:b9368142823e38e788a3385283cf5d679aa67d58a58681b0dd3923a3ac9d642a","id":"example-model","protocol":"openai-compatible"},"profile":{"digest":"sha256:b9368142823e38e788a3385283cf5d679aa67d58a58681b0dd3923a3ac9d642a","id":"example","version":"1.0.0"},"renderer":{"digest":"sha256:b9368142823e38e788a3385283cf5d679aa67d58a58681b0dd3923a3ac9d642a","id":"example","version":"1.0.0"},"runtime":{"digest":"sha256:b9368142823e38e788a3385283cf5d679aa67d58a58681b0dd3923a3ac9d642a","id":"example","version":"1.0.0"}},"mediaType":"application/vnd.agentsuite.eval.evidence.v1+json","results":[{"id":"capital","outcome":"pass","runs":[{"assertions":[{"id":"capital","outcome":"pass","type":"contains"},{"id":"not-london","outcome":"pass","type":"notContains"}],"number":1,"outcome":"pass","status":"completed"}]},{"id":"arithmetic","outcome":"pass","runs":[{"assertions":[{"id":"four","outcome":"pass","type":"regex"}],"number":1,"outcome":"pass","status":"completed"}]}],"schemaVersion":"1.0.0","subject":{"buildProfileDigest":"sha256:a7e6136d7e7daf2fcd7e61a149000382032dcbf140f2dda1076d2ee85d0a62cd","compositionDigest":"sha256:c19a6173a3bad6723b5f4c36f49c8ee21afbd65317d9c9c4275ebd130b2223d5","manifest":{"digest":"sha256:7a241dfc797cc6d9d6363808f82f43d719f1be8a24f6b533f5e449ade8e54314","mediaType":"application/vnd.oci.image.manifest.v1+json","size":463},"memberDigest":"sha256:1610e12f794faba920851c1f079882bb693111c3ea415c4648a590cea5374bda","memberID":"writer","platform":{"architecture":"amd64","os":"linux","variant":""}}}
